num,text,watermarking_scheme,model
1,"When it comes to keeping track of diabetes, the manual process can be a bit of a pain. With digital tools like apps and wearables, you can easily monitor your blood sugar levels, get insights from your data, and share it with your healthcare team whenever needed.
The best part? It makes managing diabetes much more convenient! You can focus on other important aspects of your life while having peace of mind knowing your health is being monitored.

Here are some ways how digital technology is revolutionizing diabetes management:

1. **Apps for Tracking Blood Sugar Levels**: Apps like MyFitnessPal, One Drop, and Diabetes Mate allow users to easily log their blood sugar readings, food intake, exercise, and other key metrics. This information can be synced with devices or shared directly with healthcare professionals.

2. **Continuous Glucose Monitoring (CGM) Wearables**: Wearables like FreeStyle LibreLink, Omnipod DASHPump, and Senseonics CGMs offer real-time continuous glucose monitoring, providing valuable insights into sugar patterns and trends.

3. **Personalized Health Analytics**: AI-powered systems like IBM Watson and Google DeepMind analyze medical records, lifestyle, and sensor data to identify patterns and provide personalized advice on food choices, medication, and self-care regimens.

What do you think about embracing digital tech for better diabetes management?

Share your experiences or thoughts about using digital tools to tackle diabetes!",semstamp_lsh,MaziyarPanahi/Meta-Llama-3-70B-Instruct-GPTQ
