num,text,watermarking_scheme,model
1,"Panicked investors who participated in the mammoth stock sell-off should get back into the market immediately because a lengthy hiatus often results in missing out on gains. This is particularly true during an ongoing economic expansion with low unemployment, as seen currently.
Despite the recent downturn, investors may consider taking advantage of depressed prices to load up on high-quality stocks that can potentially rebound strongly when the market recovers. Historically, markets have always recovered from downturns and continued to climb higher over time. The key is to maintain a long-term perspective, avoid emotional decision-making, and focus on solid fundamentals.
Some top-ranked Zacks stocks that could be considered for investment are:
1. **Amazon** (AMZN): With its strong brand recognition, diversified business model, and commitment to innovation, Amazon remains an attractive investment opportunity.
2. **Microsoft** (MSFT): Microsoft's dominant position in the cloud computing space, robust enterprise software offerings, and consistent dividend payouts make it a solid pick.
3. **UnitedHealth Group** (UNH): As a leading health insurer, UnitedHealth has a stable cash flow profile and consistently generates profits, making it a reliable choice in the healthcare sector.
4. **Procter & Gamble** (PG): With its iconic brands like Tide, Pampers, and Gillette, Procter & Gamble offers a defensive play with steady earnings growth potential.
5. **Coca-Cola** (KO): As a beverage giant with a diversified portfolio, Coca-Cola provides a relatively safe haven during turbulent times, backed by its consistent dividend payments.",semstamp_lsh,MaziyarPanahi/Meta-Llama-3-70B-Instruct-GPTQ
