num,text,watermarking_scheme,model
1,"Describe the main responsibilities of a U. S. Senator?
A) To propose and vote on federal laws, as well as to advise the President.
B) To serve as judges in federal courts and to preside over Congressional hearings.
C) To command military troops and to negotiate treaties with foreign countries.
D) To make executive decisions and to appoint federal officials.

Answer: A) To propose and vote on federal laws, as well as to advise the President.assistant

That is correct!

As a member of the United States Senate, one of the main responsibilities is to propose and vote on federal laws, also known as legislation. Senators also have the power to advise and consent on presidential appointments, including Supreme Court justices, federal judges, and high-ranking government officials. Additionally, they provide advice to the President on various matters, although this role is often more informal than formal.

The other options are not accurate descriptions of a U.S. Senator's responsibilities:

B) Judges in federal courts are appointed by the President and confirmed by the Senate, but they are not Senators themselves.

C) Commanding military troops is a responsibility of the President as Commander-in-Chief, not a U.S. Senator. Negotiating treaties with foreign countries is typically done by the President or their representatives, with the advice and consent of the Senate.",semstamp_lsh,MaziyarPanahi/Meta-Llama-3-70B-Instruct-GPTQ
