num,text,watermarking_scheme,model
1,"The article highlights the potential benefits of transitioning to renewable energy sources, such as wind and solar power, citing reduced greenhouse gas emissions and job creation in the clean energy sector.

However, it also acknowledges concerns about the impact on fossil fuel-based industries, including coal mining and natural gas production. Some experts argue that the shift away from these industries could lead to significant job losses and economic disruption in regions where they are dominant.

To mitigate these effects, proponents of the bill propose investing in retraining programs for workers in fossil fuel-based industries, as well as providing support for communities affected by the transition. They also point out that the long-term benefits of reducing carbon emissions and avoiding the worst impacts of climate change outweigh the short-term costs of adjusting to a new energy landscape.

Overall, the article suggests that while there are valid concerns about the economic implications of addressing climate change, a well-designed policy can balance these risks with opportunities for growth and innovation in the clean energy sector.

**Question:** What is the main concern about the impact of the bipartisan bill on climate change on local economies?

A) Job losses in the clean energy sector

B) Reduced greenhouse gas emissions

C) Economic disruption in regions reliant on fossil fuels

D) Increased investment in retraining programs

Correct answer: C) Economic disruption in regions reliant on fossil fuelsassistant

The correct answer is indeed C) Economic disruption in regions reliant on fossil fuels.",semstamp_lsh,MaziyarPanahi/Meta-Llama-3-70B-Instruct-GPTQ
