num,text,watermarking_scheme,model
1,"The bill, known as the ""Energy Innovation and Carbon Dividend Act,"" aims to reduce greenhouse gas emissions by 50% within a decade.

The article highlights the potential benefits of the bill, including:

* Creating jobs in clean energy industries such as wind and solar power, electric vehicles, and energy efficiency.
* Reducing air pollution from fossil fuels, which would improve public health and save lives.
* Generating revenue through carbon pricing, which could be used to fund infrastructure projects, education, and healthcare.

However, the article also acknowledges potential drawbacks, including:

* Increased costs for consumers, particularly low-income households, who may struggle to afford higher prices for gasoline, electricity, and other goods.
* Job losses in industries that rely heavily on fossil fuels, such as coal mining and oil refining.
* Potential negative impacts on local economies that are heavily reliant on fossil fuel-based industries.

To mitigate these risks, the article suggests that policymakers should consider implementing measures such as:

* Revenue recycling: using revenue generated from carbon pricing to support low-income households and workers in transition.
* Just transition policies: providing training and support for workers transitioning out of fossil fuel-based industries.
* Economic development strategies: investing in diversification efforts to promote new industries and job opportunities in regions heavily reliant on fossil fuels.",semstamp_lsh,MaziyarPanahi/Meta-Llama-3-70B-Instruct-GPTQ
