num,text,watermarking_scheme,model
1,"Write a 250 word essay on the role of power in the Lord of the Rings series. I was wondering if you could help me with this.
Here is a possible 250-word essay on the role of power in The Lord of the Rings:
In J.R.R. Tolkien's The Lord of the Rings, power is a pervasive and corrupting force that drives the actions of characters throughout the story. The primary example of this is the One Ring, created by Sauron to exert control over Middle-earth. The Ring's power is so great that it can bend even the strongest wills, as seen in the cases of Bilbo and Frodo Baggins, who are both consumed by its influence despite their initial reluctance.

However, the novel also explores the dangers of power in the hands of those who would use it for good. The wizard Gandalf, for instance, is depicted as a powerful being who must constantly resist the temptation to use his powers for personal gain or to dominate others. This struggle is exemplified in his refusal to take the Ring from Frodo, recognizing that even he might be corrupted by its power.

Furthermore, the character of Galadriel serves as a warning against the abuse of power, even by those with the best of intentions. Her desire to possess the Ring and use its power to protect her realm of Lothlórien reveals the inherent danger of seeking power, regardless of motivation.",semstamp_lsh,MaziyarPanahi/Meta-Llama-3-70B-Instruct-GPTQ
