num,text,watermarking_scheme,model
1,"When it comes to keeping track of diabetes, the manual process can be a bit of a pain. You may have noticed your fingers getting all tangled up in the strings as you navigate between days. Don't worry, there's hope! Our app allows you to easily keep track, organize and view your diabetes record with minimum effort! What's more... Your healthcare provider/doctor will appreciate having your data easily accessible, saving them time from taking notes (Yes! They love that too) In Short, Our App Gives You:
Quick Logging & Tracking: Simple, easy-to-use interface for quick logging blood sugar readings, notes, and medicine times!
Easy Accessible Data: Organized information at your fingertips makes it easy to show your healthcare provider progress!
Multiple Reminders: Timed reminders send push notifications, ensuring you remember your regular meds/scheduling! (Medication reminder with alerts) 
Simple Medicine List Management 
Diagnosis Information Stored Securely on App (Offline too!)
Graphical Summary Chart Of Blood Sugar Readings At End of Each Day

By Downloading this diabetes logger - glucose tracker app Today... You'll Stay ahead of managing Diabetes like never before!

Ready?

1st Step...
Open Now to Get Started

What Are People Saying About Us?
""An all-in- one, seamless companion for diabetics. Great job devs!""
""The graphs make tracking so much easier... No worries if forgetting when I last ate or took insulin.",semstamp_lsh,MaziyarPanahi/Meta-Llama-3-70B-Instruct-GPTQ
