num,text,watermarking_scheme,model
1,"When it comes to keeping track of diabetes, the manual process can be a bit of a pain. With all... Read More »
Medtronic (MRD ) was formed in 1948 by engineer Earl Bakken and cardiologist Palmer Hermundslie... and began by selling surgical implants in Minneapolis Read More» (4)
Lackof awareness and understanding can contribute tounsuccessful diabetes management This section offers valuable information... Read More» (0)
How would you answer this question, what’s your first reaction? “Do food restrictions affect my daily living with T1... Read More» (15)
Insulet Corporation, formerly known as Diomedis Inc is a medical device com… founded:in NovemberRead More» (10)
When it cme to choosing an Automated Insulin DoseAdjusment (AIDA or AutoMode system, people typically evaluate several aspects, f…r more, click Read More...tyleRead More» (11)
Omnipod Dash Personal Diabetes Manager has integrated Bolus and CGM Data. It automatically receives insulin dosage Recommendat...and CGM data to assist i… read Morе »Read More» (16)

Omnipod5, an automated glucose monitoring system includes an algorithm which evaluates glucose values along wi…readMore..Read More»

Diabetes awareness campaign has long fought for rights, resources access including insurance coverage... Rread More»

Med-Tech Company Founded in 1923byDr.SamuelKingsleyChicagoILUSARead More»

This topic on Medtronicsponsored article explores some crucial Aspects related to Continuous Monito…Read More？」

Continuous glucose monitoring(CGM) has been proven helpful both short- long term glucose regulation Click Read More...

Diabetes Awareness : The month dedicated raising awareness about Diabetes &amp;amp; providing information educati...Read More»

OmniPod's Auto-Dosing Features provides seamless tracking alongwith Insulin dosage recommendations to users!",semstamp_lsh,MaziyarPanahi/Meta-Llama-3-70B-Instruct-GPTQ
