num,text,watermarking_scheme,model
1,"When it comes to keeping track of diabetes, the manual process can be a bit of a pain. This is because it requires regularly taking readings and recording them in a log book or spreadsheet. Then there's the analysis: trying to identify patterns and trends, understand how your diet and exercise are affecting your levels, and adjusting your routine accordingly.
To make life easier for diabetics, many companies have developed innovative solutions that automate this process and provide actionable insights. Some notable examples include:

1. **Continuous Glucose Monitors (CGMs)**: These devices measure glucose levels continuously throughout the day and night, sending the data directly to a mobile app or website. No more needlesticks!
2. **Glucose meters with wireless connectivity**: Many modern glucose meters now come equipped with Bluetooth or Wi-Fi capabilities, allowing users to transmit their readings seamlessly to an app.
3. **Data analytics software**: Several platforms offer tools to crunch glucose data, providing personalized recommendations for improving management based on a person's unique needs.

In a world where smart sensors and artificial intelligence meet healthcare, managing diabetes has become increasingly efficient and empowering. For instance, AI-driven apps like Bigfoot Biomedical's D-Loop system allow patients to share data with care teams, receive timely alerts and advice, and even get real-time dosing guidance. All this through the convenience of their smartphone!

Now, imagine combining wearable technology, sensor innovations, and AI-based health monitoring platforms...",semstamp_lsh,MaziyarPanahi/Meta-Llama-3-70B-Instruct-GPTQ
